{
  "contract_version": "1.0",
  "config_version": 1,
  "issued_at": "2026-01-15T00:00:00Z",
  "not_after": "2026-01-15T00:05:00Z",
  "operations_enabled": false,
  "capabilities": {
    "gamelift.capacity-adjustment": {
      "prepare": false,
      "dispatch": false,
      "execute": false
    }
  }
}
